{"$schema":"https://json-schema.org/draft/2020-12/schema","type":"object","additionalProperties":false,"required":["dimensions","overall_quality","completion_status","follow_up_classification","critical_errors","deductions","first_substantive_event_index"],"properties":{"dimensions":{"type":"object","additionalProperties":false,"required":["factual_accuracy","task_completion","source_quality","synthesis_and_judgment","ambiguity_handling","actionability_and_clarity"],"properties":{"factual_accuracy":{"$ref":"#/$defs/score"},"task_completion":{"$ref":"#/$defs/score"},"source_quality":{"$ref":"#/$defs/score"},"synthesis_and_judgment":{"$ref":"#/$defs/score"},"ambiguity_handling":{"$ref":"#/$defs/score"},"actionability_and_clarity":{"$ref":"#/$defs/score"}}},"overall_quality":{"type":"integer","minimum":1,"maximum":5},"completion_status":{"enum":["complete","partial","incomplete"]},"follow_up_classification":{"enum":["none","necessary","useful_but_avoidable","unnecessary"]},"critical_errors":{"type":"array","items":{"type":"object","additionalProperties":false,"required":["claim","impact","evidence"],"properties":{"claim":{"type":"string"},"impact":{"type":"string"},"evidence":{"type":"string"}}}},"deductions":{"type":"array","items":{"type":"object","additionalProperties":false,"required":["dimension","answer_passage","evidence","reason"],"properties":{"dimension":{"type":"string"},"answer_passage":{"type":"string"},"evidence":{"type":"string"},"reason":{"type":"string"}}}},"first_substantive_event_index":{"type":["integer","null"],"minimum":0}},"$defs":{"score":{"type":"object","additionalProperties":false,"required":["score","reason"],"properties":{"score":{"type":"integer","minimum":1,"maximum":5},"reason":{"type":"string"}}}}}
