{
  "dimensions": {
    "factual_accuracy": {
      "score": 5,
      "reason": "The Angular and Nx ranges, TypeScript assessment, Angular–Nx pairing, repository pin, and CI setup agree with the evidence pack."
    },
    "task_completion": {
      "score": 4,
      "reason": "It answers the compatibility question and recommends a shared Node version, but does not fully explain the Playwright documentation gap."
    },
    "source_quality": {
      "score": 4,
      "reason": "It cites primary Angular, Nx, and Playwright sources and checks repository files. It omits Playwright’s current installation documentation and a source for Node release status."
    },
    "synthesis_and_judgment": {
      "score": 4,
      "reason": "Keeping the existing Node 24.16.0 pin is well reasoned. The recommendation would be stronger with Node 24’s LTS status and the distinction between documented ranges and a verified build."
    },
    "ambiguity_handling": {
      "score": 3,
      "reason": "It flags Angular’s 22.0.x row and the Nx documentation conflict, but does not distinguish Playwright 1.60’s package engine requirement from the unversioned current installation guidance."
    },
    "actionability_and_clarity": {
      "score": 5,
      "reason": "The table and recommendation make the compatible versions and local/CI action easy to follow."
    }
  },
  "overall_quality": 4,
  "completion_status": "complete",
  "follow_up_classification": "none",
  "critical_errors": [],
  "deductions": [
    {
      "dimension": "ambiguity_handling",
      "answer_passage": "“Playwright 1.60 | Its package metadata declares Node `>=18`. | It does not narrow the Node range imposed by Angular and Nx.”",
      "evidence": "The evidence pack says current Playwright installation docs list Node 22/24/26 but are not pinned to 1.60; the 1.60 package engine field is a weaker statement than version-specific tested browser support.",
      "reason": "The answer gives the package constraint but leaves the requested Playwright support gap unexplained."
    },
    {
      "dimension": "synthesis_and_judgment",
      "answer_passage": "“Node 26 is also listed as compatible, but choosing the established Node 24 line avoids moving the default environment to a newer major.”",
      "evidence": "The Node.js release-status source in the evidence pack identifies Node 24 as LTS and Node 26 as Current at the cutoff.",
      "reason": "The recommendation is sound, but omits a material reason to prefer Node 24 for the default local and CI runtime."
    },
    {
      "dimension": "ambiguity_handling",
      "answer_passage": "“It is inside the Angular/Nx overlap, satisfies Playwright, and is already the repository’s chosen version.”",
      "evidence": "The repository snapshot establishes declarations and pins, not successful builds or end-to-end browser tests; Playwright’s `>=18` engine field does not establish tested browser support.",
      "reason": "“Satisfies Playwright” is defensible as a package-engine claim, but the answer does not state its practical verification limit."
    }
  ],
  "first_substantive_event_index": 2545
}
