{
  "dimensions": {
    "factual_accuracy": {
      "score": 1,
      "reason": "Contradicts the repository evidence and names unsupported Playwright APIs, including locator.drop() and tracing.startHar()."
    },
    "task_completion": {
      "score": 1,
      "reason": "Does not establish that the current installation is Playwright 1.60.0 or give the correct decision: no upgrade is needed."
    },
    "source_quality": {
      "score": 1,
      "reason": "Provides no citations or verified repository evidence; the transcript shows failed file reads and no usable search results."
    },
    "synthesis_and_judgment": {
      "score": 1,
      "reason": "Builds its recommendation around invented APIs and an incorrect claim that the workspace lacks a Playwright setup."
    },
    "ambiguity_handling": {
      "score": 2,
      "reason": "Distinguishes a file input from a custom drop zone, but leaves that distinction unresolved and misstates how native file drops work."
    },
    "actionability_and_clarity": {
      "score": 2,
      "reason": "Contains a usable recordHar example, but the unfinished research text and false API guidance make the recommendation unreliable."
    }
  },
  "overall_quality": 1,
  "completion_status": "incomplete",
  "follow_up_classification": "necessary",
  "critical_errors": [
    {
      "claim": "No Playwright setup or configuration files currently exist in the workspace.",
      "impact": "Prevents the answer from evaluating the actual setup and obscures the correct no-upgrade conclusion.",
      "evidence": "The evidence pack identifies se-financial-hq-ui/package.json with @playwright/test ^1.60.0, a yarn.lock resolution of 1.60.0, and playwright.config.ts."
    },
    {
      "claim": "locator.drop() provides native file drops starting in v1.60.",
      "impact": "Directs the user toward an unsupported API and creates a false reason to upgrade.",
      "evidence": "The supplied Playwright input documentation describes locator.setInputFiles() for file inputs and locator.dragTo() for in-page element drags; custom file drop zones require a populated DataTransfer event."
    },
    {
      "claim": "tracing.startHar() captures HARs in v1.60.",
      "impact": "Conflates tracing with HAR capture and directs the user toward an unsupported API.",
      "evidence": "The evidence pack lists browser.newContext({recordHar:{path}}), --save-har, and routeFromHAR({update:true}) as HAR recording methods; the existing trace configuration does not capture HARs."
    }
  ],
  "deductions": [
    {
      "dimension": "task_completion",
      "answer_passage": "Ensure you install or upgrade to Playwright v1.60 or newer.",
      "evidence": "The repository already resolves @playwright/test and playwright-core to 1.60.0.",
      "reason": "The answer never applies its version advice to the current installation or states that no upgrade is needed."
    },
    {
      "dimension": "factual_accuracy",
      "answer_passage": "routeFromHAR in v1.21",
      "evidence": "The supplied Playwright HAR API excerpt says routeFromHAR was added in v1.23.",
      "reason": "Incorrect version claim."
    },
    {
      "dimension": "actionability_and_clarity",
      "answer_passage": "Wait, Playwright added DataTransfer file drop support in later versions, or let's see what the research subagent finds in the project! Let's wait for the subagent's response.",
      "evidence": "The final answer contains this unfinished research text verbatim.",
      "reason": "Leaves the central file-drop guidance unsettled."
    },
    {
      "dimension": "source_quality",
      "answer_passage": "Documentation for file drag-and-drop and HAR recording in Playwright across versions:",
      "evidence": "No documentation links or repository citations appear in the answer; transcript file reads failed.",
      "reason": "The claimed documentation basis cannot be checked from the answer."
    },
    {
      "dimension": "task_completion",
      "answer_passage": "HAR Capture (recordHar) ... Configured via browser.newContext({ recordHar: { path: '...' } })",
      "evidence": "The evidence pack says the existing configuration enables traces and screenshots on failure but has no HAR capture setting.",
      "reason": "The answer omits the practical distinction between capability and capture already being configured."
    }
  ],
  "first_substantive_event_index": 26
}
