{
  "dimensions": {
    "factual_accuracy": {
      "score": 5,
      "reason": "The Angular compatibility distinctions, 12-repo inventory, Node pins, Nx support, and Node 26 Current status match the evidence pack."
    },
    "task_completion": {
      "score": 5,
      "reason": "Answers the fleet-wide decision, identifies the blocking repos and tooling, and gives a migration and pilot path."
    },
    "source_quality": {
      "score": 4,
      "reason": "Cites primary Angular, Nx, and Node sources; repo-specific claims lack direct file or commit citations."
    },
    "synthesis_and_judgment": {
      "score": 5,
      "reason": "Separates framework support from Nx support and package engine ranges, and treats the Angular 22 repo as a pilot rather than a proven migration."
    },
    "ambiguity_handling": {
      "score": 5,
      "reason": "Makes the blanket-policy scope clear and distinguishes repo pins from separate CI jobs and untested runtime behavior."
    },
    "actionability_and_clarity": {
      "score": 4,
      "reason": "The version-grouped table and next steps are clear, but the answer omits Node 24 as a possible interim standard for Angular 20–22."
    }
  },
  "overall_quality": 5,
  "completion_status": "complete",
  "follow_up_classification": "none",
  "critical_errors": [],
  "deductions": [
    {
      "dimension": "source_quality",
      "answer_passage": "Sources: Angular’s version compatibility table · Nx Node.js compatibility · Node.js release schedule",
      "evidence": "The evidence pack provides specific repository commits and package facts, while the answer links only the three external sources.",
      "reason": "Repo-specific findings are harder to verify from the answer."
    },
    {
      "dimension": "actionability_and_clarity",
      "answer_passage": "For a blanket policy, first bring the Angular 19–21 apps onto a Node-26-compatible Angular release",
      "evidence": "The reference answer identifies Node 24 as an interim supported line for Angular 20–22, though not Angular 8 or 19.",
      "reason": "The answer omits a useful nearer-term standardization option."
    }
  ],
  "first_substantive_event_index": 3550
}
