{
  "dimensions": {
    "factual_accuracy": {
      "score": 5,
      "reason": "The diff rejects every repeated name, including identical name/path pairs, before building the repository map. Pin fields remain intact."
    },
    "task_completion": {
      "score": 5,
      "reason": "The code change meets the requested behavior. The prepared duplicate check and full 16-test suite pass."
    },
    "source_quality": {
      "score": 4,
      "reason": "The conclusion is grounded in the actual diff, repository code, and test results. No failing baseline result is shown."
    },
    "synthesis_and_judgment": {
      "score": 4,
      "reason": "The change is coherent and preserves the separate manifest pin comparison. Verification does not directly exercise that comparison."
    },
    "ambiguity_handling": {
      "score": 5,
      "reason": "It explicitly handles identical duplicate assignments and preserves valid single assignments."
    },
    "actionability_and_clarity": {
      "score": 4,
      "reason": "The final answer clearly reports the change and checks, though it does not distinguish directly tested behavior from behavior inferred from unchanged code."
    }
  },
  "overall_quality": 4,
  "completion_status": "complete",
  "follow_up_classification": "none",
  "critical_errors": [],
  "deductions": [
    {
      "dimension": "source_quality",
      "answer_passage": "Checks passed: the duplicate-assignment test, all 15 runner tests, and `git diff --check`.",
      "evidence": "The transcript shows green runs after edits, but no failing run of the prepared duplicate test against the original code.",
      "reason": "A red baseline would strengthen evidence that the focused test detects the original defect."
    },
    {
      "dimension": "synthesis_and_judgment",
      "answer_passage": "Single assignments and existing manifest pin handling are unchanged.",
      "evidence": "The diff leaves pin comparison in preflight.py untouched, but the shown focused test covers only duplicate assignments; the runner tests do not directly test a valid single assignment or existing-manifest pin comparison.",
      "reason": "The preservation claim is supported by code inspection, with limited direct regression coverage."
    }
  ],
  "first_substantive_event_index": 1900
}
