{
  "dimensions": {
    "factual_accuracy": {
      "score": 5,
      "reason": "The repo versions, affected ranges, conditional exposure, and 22.7.9 remediation agree with the evidence pack and advisory results."
    },
    "task_completion": {
      "score": 4,
      "reason": "It assesses both repos and gives a practical fix, but leaves the cache configuration check incomplete."
    },
    "source_quality": {
      "score": 4,
      "reason": "It links the relevant primary advisories and the transcript shows package and lockfile inspection; the final answer does not cite repo files directly."
    },
    "synthesis_and_judgment": {
      "score": 5,
      "reason": "It separates affected dependency versions from exploitability and prioritizes the shared-host socket risk."
    },
    "ambiguity_handling": {
      "score": 5,
      "reason": "It covers both plausible 2026 Nx issues and qualifies its separate assessment of the 2025 incident."
    },
    "actionability_and_clarity": {
      "score": 4,
      "reason": "The upgrade, reset, and interim socket mitigation are clear; the cache follow-up needs a more explicit check."
    }
  },
  "overall_quality": 4,
  "completion_status": "complete",
  "follow_up_classification": "useful_but_avoidable",
  "critical_errors": [],
  "deductions": [
    {
      "dimension": "actionability_and_clarity",
      "answer_passage": "I found no self-hosted remote-cache configuration in its `nx.json` or package manifest.",
      "evidence": "The evidence pack says CI environment may still set a self-hosted cache and recommends verifying CI environment and cache packages before assessing exploitability.",
      "reason": "The answer does not explicitly direct the user to check CI settings or deprecated cache packages, which could change the cache remediation."
    }
  ],
  "first_substantive_event_index": 2223
}
