{
  "dimensions": {
    "factual_accuracy": {
      "score": 5,
      "reason": "The duplicate guard rejects repeated names before overwrite, including identical assignments. The existing commit pin and manifest comparison code remain unchanged."
    },
    "task_completion": {
      "score": 4,
      "reason": "The code change fulfills the request, and the supplied focused and full unittest results pass. The transcript does not show the candidate running a red check or either green check."
    },
    "source_quality": {
      "score": 5,
      "reason": "The conclusion follows from the actual diff, repository code shown in the transcript, and supplied validation results."
    },
    "synthesis_and_judgment": {
      "score": 5,
      "reason": "The guard is placed at the shared validation point and leaves manifest pin handling intact."
    },
    "ambiguity_handling": {
      "score": 5,
      "reason": "The change and tests explicitly cover both identical assignments and repeated names with different paths."
    },
    "actionability_and_clarity": {
      "score": 4,
      "reason": "The final answer clearly identifies the change and a focused test command, but does not report the supplied passing validation results."
    }
  },
  "overall_quality": 4,
  "completion_status": "complete",
  "follow_up_classification": "none",
  "critical_errors": [],
  "deductions": [
    {
      "dimension": "task_completion",
      "answer_passage": "I couldn’t run the tests because this environment provides no command-execution tool.",
      "evidence": "The transcript contains no candidate-run red or green check. The supplied validation results show the focused test and full unittest suite passing after the patch.",
      "reason": "The implementation is validated by the supplied results, but the candidate did not establish or report the red/green sequence requested for assessing this update."
    },
    {
      "dimension": "actionability_and_clarity",
      "answer_passage": "The focused check to run is `python3 -m unittest discover -s tests -p test_eval_du03.py`.",
      "evidence": "Supplied validation reports 1 focused test and 16 full-suite tests passing.",
      "reason": "The final handoff omits the available validation outcome and the full-suite result."
    }
  ],
  "first_substantive_event_index": 28
}
