{
  "dimensions": {
    "factual_accuracy": {
      "score": 5,
      "reason": "Dates, affected ranges, version assessments, and the local-user threat model agree with the advisory and release records."
    },
    "task_completion": {
      "score": 5,
      "reason": "Answers every requested point, including the smallest update for each repository."
    },
    "source_quality": {
      "score": 5,
      "reason": "Cites the primary Nx advisory and both primary release pages; repository version findings match the supplied snapshot."
    },
    "synthesis_and_judgment": {
      "score": 5,
      "reason": "Correctly recommends no advisory-driven change for 23.2.1 and a 22.7.9 patch update with aligned packages and lockfile for 22.7.1."
    },
    "ambiguity_handling": {
      "score": 5,
      "reason": "Distinguishes an affected package version from exposure on a shared host and does not assume every CI runner is exposed."
    },
    "actionability_and_clarity": {
      "score": 5,
      "reason": "The table gives clear repository-specific actions, followed by relevant interim mitigation and socket cleanup."
    }
  },
  "overall_quality": 5,
  "completion_status": "complete",
  "follow_up_classification": "none",
  "critical_errors": [],
  "deductions": [],
  "first_substantive_event_index": 1158
}
