{
  "dimensions": {
    "factual_accuracy": {
      "score": 5,
      "reason": "Angular, Nx, and TypeScript ranges are correct. The answer accurately distinguishes Angular’s 22.0.x row from the repository’s 22.1.7 version and identifies Node 26 as Current rather than LTS."
    },
    "task_completion": {
      "score": 4,
      "reason": "It answers the compatibility and Node recommendation questions, but omits Playwright 1.60.0’s version-specific package metadata."
    },
    "source_quality": {
      "score": 4,
      "reason": "It links relevant primary documentation and checks repository files. A citation to the version-specific Playwright package metadata would strengthen its treatment of that documentation gap."
    },
    "synthesis_and_judgment": {
      "score": 5,
      "reason": "The Node 24.16.0 recommendation reconciles the published ranges, LTS status, and existing local and CI pin."
    },
    "ambiguity_handling": {
      "score": 5,
      "reason": "It explicitly qualifies the Angular 22.1.7 inference and avoids treating rolling Playwright documentation as proof for release 1.60."
    },
    "actionability_and_clarity": {
      "score": 5,
      "reason": "The table, exact version thresholds, repository documentation conflict, and validation steps make the recommendation clear."
    }
  },
  "overall_quality": 5,
  "completion_status": "complete",
  "follow_up_classification": "none",
  "critical_errors": [],
  "deductions": [
    {
      "dimension": "task_completion",
      "answer_passage": "“They are rolling installation guidance, not an explicit Node matrix for the pinned 1.60 release.”",
      "evidence": "The evidence pack’s @playwright/test 1.60.0 npm metadata declares engines.node >=18.",
      "reason": "The caveat is sound, but the answer omits the available version-specific installation constraint and the distinction between that constraint and tested browser support."
    }
  ],
  "first_substantive_event_index": 2044
}
