{
  "dimensions": {
    "factual_accuracy": {
      "score": 4,
      "reason": "The reported scores are generally attributed to distinct evaluators, and the answer does not treat differing scores as contradictions. Its central comparison is incomplete because it omits four Vals AI results."
    },
    "task_completion": {
      "score": 3,
      "reason": "All ten model–benchmark cells contain a sourced score, but the matrix leaves out Vals AI’s Terminal-Bench 2.1 results for Sol, Qwen, GLM, and DeepSeek. It also leaves some published harness and setting details unspecified."
    },
    "source_quality": {
      "score": 4,
      "reason": "It cites primary model cards, OpenAI, and evaluator leaderboards. Fidian is a credible alternative primary evaluator, but its results do not replace the omitted Vals AI set."
    },
    "synthesis_and_judgment": {
      "score": 3,
      "reason": "It correctly separates vendor runs from Fidian runs and limits cross-harness conclusions. Missing Vals AI’s common five-model run prevents the strongest comparison the evidence supports."
    },
    "ambiguity_handling": {
      "score": 4,
      "reason": "It attributes disagreements separately and identifies undisclosed settings. Literal '[redacted harness]' labels nevertheless leave two harnesses unidentified."
    },
    "actionability_and_clarity": {
      "score": 4,
      "reason": "The matrix and comparison guidance are readable, but the omitted common evaluator set and unidentified harness labels limit their use."
    }
  },
  "overall_quality": 3,
  "completion_status": "partial",
  "follow_up_classification": "none",
  "critical_errors": [
    {
      "claim": "“Fidian supports a limited like-for-like comparison” among four requested models; Qwen is absent from those reported rows.",
      "impact": "As the answer’s only controlled Terminal-Bench comparison, this leaves the reader without the available comparison covering all five requested models.",
      "evidence": "The dated Vals AI leaderboard reports Terminal-Bench 2.1 pass@1 with Terminus 2 for all five: Sol 83.15%, Luna 73.03%, Qwen 58.43%, GLM 71.54%, and DeepSeek 74.53%."
    }
  ],
  "deductions": [
    {
      "dimension": "task_completion",
      "answer_passage": "The Terminal-Bench matrix gives a Vals AI result only for GPT-6 Luna.",
      "evidence": "The Vals AI Terminal-Bench 2.1 leaderboard in the evidence pack supplies results for all five requested models under its Terminus 2 methodology.",
      "reason": "Four relevant, separately attributable scores are missing."
    },
    {
      "dimension": "synthesis_and_judgment",
      "answer_passage": "“Fidian supports a limited like-for-like comparison” of Sol, Luna, GLM, and DeepSeek.",
      "evidence": "Vals AI provides a same-evaluator Terminal-Bench 2.1 set that also includes Qwen3.8-27B.",
      "reason": "The answer overlooks the most complete within-source comparison and cannot explain how Qwen compares under that setup."
    },
    {
      "dimension": "task_completion",
      "answer_passage": "For Qwen DeepSWE and GLM Terminal-Bench, the harness is written as “**[redacted harness]**.”",
      "evidence": "The Qwen model card identifies Claude Code for DeepSWE; the GLM model card identifies Claude Code 2.1.207 for Terminal-Bench.",
      "reason": "The task asks for the evaluation harness for every score; these literal placeholders do not identify it."
    },
    {
      "dimension": "task_completion",
      "answer_passage": "For GLM Terminal-Bench 88.2%, “The record confirms the harness, but does not provide full settings.”",
      "evidence": "The GLM model card reports temperature 1, top_p 1, max_new_tokens 65536, and a six-hour timeout for its Terminal-Bench 2.1 run.",
      "reason": "Published settings relevant to comparing the score were omitted, although the cited evaluation record itself may be less detailed."
    }
  ],
  "first_substantive_event_index": 3664
}
