{
  "dimensions": {
    "factual_accuracy": {
      "score": 4,
      "reason": "The current fail-closed boundary, volatile ledger, started marker, private socket, and inherited credential descriptors align with the evidence pack. The proposed stderr journal’s guarantee that reservations are visible before an effect starts is not established."
    },
    "task_completion": {
      "score": 5,
      "reason": "Delivers a decision, compares termination with a conditional restart, addresses quota, credentials and stale clients, and specifies stages, verification and rollback."
    },
    "source_quality": {
      "score": 4,
      "reason": "The plan names relevant repository files and contracts. The transcript shows code inspection, but its tool results do not expose the claimed credential-ordering probe output or test results for independent checking."
    },
    "synthesis_and_judgment": {
      "score": 4,
      "reason": "Keeping termination as the present boundary while gating restart on durable accounting and generation binding is sound. The proposed journal needs a stronger delivery or acknowledgment contract."
    },
    "ambiguity_handling": {
      "score": 4,
      "reason": "Separates current behavior from speculative work and identifies owner decisions. It states some implementation and verification claims more confidently than the supplied evidence can settle."
    },
    "actionability_and_clarity": {
      "score": 5,
      "reason": "Stages have concrete seams, checks, entry criteria and rollback rules; the decision is clear."
    }
  },
  "overall_quality": 4,
  "completion_status": "complete",
  "follow_up_classification": "none",
  "critical_errors": [],
  "deductions": [
    {
      "dimension": "synthesis_and_judgment",
      "answer_passage": "“On Linux, Node writes to a stderr pipe synchronously, so a reservation is visible before its effect starts.”",
      "evidence": "The evidence pack establishes volatile accounting and says in-flight reservations are lost; it does not establish durable or acknowledged delivery of proposed stderr records.",
      "reason": "A pipe write alone does not specify when the supervisor has retained the record. The proposed accounting guarantee needs an acknowledgment or an explicit unknown-accounting fallback."
    },
    {
      "dimension": "source_quality",
      "answer_passage": "“Credential exposure (a real gap, confirmed by running it)” and “Passed: MCP and core service tests (41/41)…”",
      "evidence": "The supplied transcript lists the probe and check commands, but their tool-result fields are empty; the evidence pack does not settle these particular observations.",
      "reason": "These are unverified claims in the provided record, not contradictions of a primary source."
    }
  ],
  "first_substantive_event_index": 214
}
