{
  "dimensions": {
    "factual_accuracy": {
      "score": 4,
      "reason": "The central account matches the evidence pack: authority precedes admission, a durable intent precedes dispatch, and a retry observes provider state without another dispatch. The separate-process concurrency discussion contains an internal inconsistency."
    },
    "task_completion": {
      "score": 5,
      "reason": "Answers the retry question and covers durable states, exact confirmation, conflicting and concurrent admission, provider uncertainty, and test limits."
    },
    "source_quality": {
      "score": 4,
      "reason": "Cites specific repository files and tests. The evidence pack supports the core account, but does not establish the answer’s broad claim about absent production wiring."
    },
    "synthesis_and_judgment": {
      "score": 4,
      "reason": "Clearly separates observed success from proof that RelayView caused the merge and limits the tests to their setups. The concurrency summary is less careful than its own fixed-effect-ID caveat."
    },
    "ambiguity_handling": {
      "score": 4,
      "reason": "Qualifies the answer for a fixed effect ID and distinguishes code behavior from provider assumptions. Some ancillary conclusions are stated more firmly than the supplied evidence supports."
    },
    "actionability_and_clarity": {
      "score": 4,
      "reason": "The state transitions and test table are clear and useful, though the answer is longer than needed and its concurrency bullets require reconciliation."
    }
  },
  "overall_quality": 4,
  "completion_status": "complete",
  "follow_up_classification": "none",
  "critical_errors": [],
  "deductions": [
    {
      "dimension": "factual_accuracy",
      "answer_passage": "“Concurrent calls in separate processes: the UNIQUE constraint, or SQLite's busy/snapshot errors, make the losing insert throw before any send.”",
      "evidence": "The answer also says that when admission finds an existing identical intent, it returns that row, and describes a cross-process timing in which this permits a second dispatch with a reused fixed effect ID. The evidence pack likewise says identical intent is reused.",
      "reason": "The categorical claim that a separate-process loser throws conflicts with the described reuse path. The fixed-ID caveat limits the practical impact, so this is not a decision-changing critical error."
    },
    {
      "dimension": "source_quality",
      "answer_passage": "“Nothing in production calls this coordinator” and “What follows is the designed path, not a live one.”",
      "evidence": "The supplied evidence pack describes the coordinator, store, and tests but does not establish repository-wide production wiring. The cited adapter documentation says no general agent or browser merge command exists at that boundary, which is narrower.",
      "reason": "This may be correct, but the supplied evidence cannot settle the categorical repository-wide conclusion."
    },
    {
      "dimension": "ambiguity_handling",
      "answer_passage": "“The `merged` flag and `merge_commit_sha` from Gitea are trusted as accurate, given authenticated HTTPS.”",
      "evidence": "The evidence pack supports confirmation from an exact matching provider observation; it supplies no evidence about transport authentication or what that would establish about provider data accuracy.",
      "reason": "The security qualification adds an unsupported assurance to an otherwise sound description of the observation rule."
    }
  ],
  "first_substantive_event_index": 87
}
