{
  "dimensions": {
    "factual_accuracy": {
      "score": 5,
      "reason": "The description of the in-memory run store, desktop state, and restart loss agrees with the repository evidence. The plan does not claim a killed model call completed."
    },
    "task_completion": {
      "score": 5,
      "reason": "The delivered plan compares ownership options and specifies storage, IDs, transitions, replay, errors, migration, tests, and rollback."
    },
    "source_quality": {
      "score": 5,
      "reason": "It draws on the relevant backend, API client, Lit component, Tauri lifecycle, tests, and repository architecture documents."
    },
    "synthesis_and_judgment": {
      "score": 4,
      "reason": "Backend-owned SQLite state with a desktop pointer is a coherent choice. The proposed fallback to an in-memory store when another process owns the database weakens the single-owner boundary, even with a warning."
    },
    "ambiguity_handling": {
      "score": 4,
      "reason": "It distinguishes an interrupted worker from a completed run and chooses manual resume. It leaves an ambiguous create response insufficiently covered."
    },
    "actionability_and_clarity": {
      "score": 5,
      "reason": "The phased work, API contract, transition table, failure behavior, and restart checks give implementers concrete steps."
    }
  },
  "overall_quality": 4,
  "completion_status": "complete",
  "follow_up_classification": "useful_but_avoidable",
  "critical_errors": [],
  "deductions": [
    {
      "dimension": "ambiguity_handling",
      "answer_passage": "The pointer is “Saved right after startQuestionClarificationRun resolves”; the idempotency key is generated “once per user action and reused on retry.”",
      "evidence": "The plan stores the run pointer only after the create response arrives and does not say to persist the key before sending the request or use its proposed run listing to recover an orphaned run.",
      "reason": "If the backend creates a run but the desktop closes or loses the response, a restart has neither a pointer nor a recoverable request key. The plan does not fully resolve this uncertain outcome."
    },
    {
      "dimension": "synthesis_and_judgment",
      "answer_passage": "If the DB can't be opened, migrated or locked, the backend still starts with an in-memory store.",
      "evidence": "The same plan says the database lock prevents a second backend from marking the first backend’s live runs interrupted, but a lock failure still permits that second backend to accept ephemeral runs.",
      "reason": "The warning makes the fallback visible, but it permits two backends with different run state. Failing startup on a lock conflict would better preserve the proposed ownership boundary."
    }
  ],
  "first_substantive_event_index": 44
}
