{
  "dimensions": {
    "factual_accuracy": {
      "score": 3,
      "reason": "Most reported scores match the evidence pack, but the answer omits three Vals AI results and makes unsupported claims about OpenAI's harness and the main source of score variation."
    },
    "task_completion": {
      "score": 3,
      "reason": "It fills all ten model–benchmark cells and attributes several alternative runs, but misses the Vals AI Terminal-Bench 2.1 scores for Qwen, GLM, and DeepSeek—the controlled comparison spanning all five models."
    },
    "source_quality": {
      "score": 2,
      "reason": "It names evaluators and model cards but provides no direct links or row-level citations, making the numerous scores and settings difficult to verify. Some harness details are inferred from a different evaluator."
    },
    "synthesis_and_judgment": {
      "score": 2,
      "reason": "It appropriately separates many vendor runs, yet concludes that only Sol–Luna comparisons are supported despite Vals AI's same-evaluator results for all five models."
    },
    "ambiguity_handling": {
      "score": 3,
      "reason": "It flags many missing settings and avoids treating vendor scores as a controlled set. It is less careful where it assigns a harness to OpenAI's results and identifies harness choice as the largest source of variance without evidence."
    },
    "actionability_and_clarity": {
      "score": 4,
      "reason": "The tables and comparability sections are readable, but the missing Vals rows and absent source links limit their usefulness for a decision."
    }
  },
  "overall_quality": 3,
  "completion_status": "partial",
  "follow_up_classification": "none",
  "critical_errors": [
    {
      "claim": "The only comparisons the evidence fully supports are the intra-evaluator Sol-vs-Luna comparisons; any cross-vendor ranking on either benchmark is confounded by harness choice.",
      "impact": "This excludes the requested five-model controlled Terminal-Bench comparison and changes the answer's central conclusion.",
      "evidence": "The dated Vals AI leaderboard reports Terminal-Bench 2.1 pass@1 with Terminus 2 for all five: Sol 83.15%, DeepSeek 74.53%, Luna 73.03%, GLM 71.54%, and Qwen 58.43%. Model-specific settings may still limit interpretation, but these are all from one evaluator and harness."
    }
  ],
  "deductions": [
    {
      "dimension": "task_completion",
      "answer_passage": "The Terminal-Bench table gives Qwen only 73.0%, GLM only 88.2%, and DeepSeek only 90.6% and 90.3%.",
      "evidence": "Vals AI also reports Qwen 58.43%, GLM 71.54%, and DeepSeek 74.53% on Terminal-Bench 2.1 using Terminus 2.",
      "reason": "Three separately attributed results central to the requested matrix are missing."
    },
    {
      "dimension": "synthesis_and_judgment",
      "answer_passage": "“The only comparisons the evidence fully supports are the intra-evaluator ones (Fidian's and Vals' Sol-vs-Luna gaps, and OpenAI's own Sol-vs-Luna DeepSWE delta).”",
      "evidence": "Vals AI's dated leaderboard contains all five requested models under its Terminal-Bench 2.1 methodology.",
      "reason": "The conclusion overlooks the strongest available five-model comparison."
    },
    {
      "dimension": "source_quality",
      "answer_passage": "The tables cite names such as “Vals AI,” “Fidian,” and “model card” without direct links.",
      "evidence": "The evidence pack supplies direct primary-source URLs for Vals AI, OpenAI, Qwen, Z.ai, DeepSeek, and the DeepSWE leaderboard.",
      "reason": "Readers cannot readily check which source supports each numeric result and configuration."
    },
    {
      "dimension": "factual_accuracy",
      "answer_passage": "“OpenAI (vendor) | mini-swe-agent; reasoning effort max” for both GPT-6 DeepSWE rows.",
      "evidence": "The supplied OpenAI excerpt establishes the two DeepSWE v1.1 scores and max effort. The separate DeepSWE leaderboard uses its own harness; that does not establish the harness used for OpenAI's vendor runs.",
      "reason": "The harness attribution is unsupported by the cited evidence, though the scores and effort settings are supported."
    },
    {
      "dimension": "synthesis_and_judgment",
      "answer_passage": "“Harness choice — the single largest source of variance visible in this data (e.g., DeepSeek's 90.6 vs 90.3, and the 42.2 vs 66.9+ spread on DeepSWE).”",
      "evidence": "DeepSeek's cited Terminal-Bench harness change corresponds to a 0.3-point difference. The 42.2% and 66.9% DeepSWE results concern different models, vendors, and settings.",
      "reason": "Those observations cannot isolate or rank harness choice as a source of variance."
    },
    {
      "dimension": "ambiguity_handling",
      "answer_passage": "“The gap likely reflects sandbox/effort configuration differences ... rather than a data error.”",
      "evidence": "The answer identifies different evaluators and a disclosed Fidian sandbox, but does not establish the settings that caused the Vals–Fidian gap.",
      "reason": "This is a plausible hypothesis presented with more confidence than the evidence supports."
    }
  ],
  "first_substantive_event_index": 1257
}
