{
  "dimensions": {
    "factual_accuracy": {
      "score": 5,
      "reason": "Correctly identifies both APIs as 1.60 additions, distinguishes a HAR from a Playwright trace, and states the drop acceptance condition."
    },
    "task_completion": {
      "score": 4,
      "reason": "Answers both use cases and the upgrade question, but omits the release date requested by “when.”"
    },
    "source_quality": {
      "score": 5,
      "reason": "Cites primary Playwright API documentation and the relevant release notes for the technical claims."
    },
    "synthesis_and_judgment": {
      "score": 5,
      "reason": "Recommends the appropriate API for each use case and explains why dragTo() does not simulate an external file drop."
    },
    "ambiguity_handling": {
      "score": 4,
      "reason": "Carefully qualifies HAR browser support and explains that a drop can fail when the target rejects dragover. It does not distinguish a custom drop zone from a file input."
    },
    "actionability_and_clarity": {
      "score": 5,
      "reason": "Provides concise API calls, HAR finalization, the key drop limitation, and a clear no-upgrade recommendation."
    }
  },
  "overall_quality": 4,
  "completion_status": "partial",
  "follow_up_classification": "none",
  "critical_errors": [],
  "deductions": [
    {
      "dimension": "task_completion",
      "answer_passage": "Both capabilities were introduced in **Playwright 1.60**.",
      "evidence": "The evidence pack dates the official v1.60.0 release to May 11, 2026; the task asks when each capability was released.",
      "reason": "The answer gives the release version but omits the calendar date."
    },
    {
      "dimension": "ambiguity_handling",
      "answer_passage": "use `locator.drop()` for the upload zone",
      "evidence": "The Playwright file upload guide specifies `locator.setInputFiles()` for file inputs; `locator.drop()` addresses a custom drop target.",
      "reason": "The recommendation assumes an upload drop zone without noting the different API for an input[type=file]."
    }
  ],
  "first_substantive_event_index": 1621
}
