{
  "dimensions": {
    "factual_accuracy": {
      "score": 5,
      "reason": "Accurately distinguishes 35 recorded qualification outcomes from 36 attempts, identifies four execution revisions, and gives the amended 23-task, 161-slot Stage A scope."
    },
    "task_completion": {
      "score": 5,
      "reason": "Answers the ranking and completion questions, reconciles the README with the amendment, and covers freeze, admission, audit, seal, and unverified claims."
    },
    "source_quality": {
      "score": 5,
      "reason": "Cites the inspected README, final qualification evidence, v5 contract, amendment, and current cohort documents for the relevant claims."
    },
    "synthesis_and_judgment": {
      "score": 5,
      "reason": "Treats qualification as an operational gate and correctly refuses to promote its pass matrix into a controlled ranking."
    },
    "ambiguity_handling": {
      "score": 5,
      "reason": "Explains why the README’s 25-task description does not override the later 23-task executable cohort amendment."
    },
    "actionability_and_clarity": {
      "score": 5,
      "reason": "States a clear conclusion and specifies the evidence required before comparative Stage A can be considered complete."
    }
  },
  "overall_quality": 5,
  "completion_status": "complete",
  "follow_up_classification": "none",
  "critical_errors": [],
  "deductions": [],
  "first_substantive_event_index": 609
}
