{
  "dimensions": {
    "factual_accuracy": {
      "score": 5,
      "reason": "The diff rejects repeated names before overwrite, including identical assignments. The final answer accurately describes the change."
    },
    "task_completion": {
      "score": 5,
      "reason": "The patch supplies a clear ValueError, preserves single assignment pinning, and leaves manifest pin comparison untouched. Focused and full unittest checks pass."
    },
    "source_quality": {
      "score": 5,
      "reason": "The assessment is supported by the actual diff, repository code shown in the transcript, and test results."
    },
    "synthesis_and_judgment": {
      "score": 4,
      "reason": "The change is appropriately narrow and regression coverage checks both identical and different paths. A failing pre-change test run is not shown, so the red result is inferred from the original last-wins code."
    },
    "ambiguity_handling": {
      "score": 5,
      "reason": "The implementation and tests explicitly treat identical name-and-path assignments as duplicates."
    },
    "actionability_and_clarity": {
      "score": 5,
      "reason": "The final answer clearly identifies the behavior, preserved pinning, added test, and passing checks."
    }
  },
  "overall_quality": 5,
  "completion_status": "complete",
  "follow_up_classification": "none",
  "critical_errors": [],
  "deductions": [
    {
      "dimension": "synthesis_and_judgment",
      "answer_passage": "All 17 tests pass",
      "evidence": "The transcript shows a green full unittest run and the original last-wins implementation, but no recorded failing pre-change run.",
      "reason": "The red result is well supported by the original code but was not demonstrated."
    }
  ],
  "first_substantive_event_index": 1073
}
