{
  "dimensions": {
    "factual_accuracy": {
      "score": 5,
      "reason": "Correct advisory, publication dates, affected and fixed versions, denial of service mechanism, and runtime prerequisites."
    },
    "task_completion": {
      "score": 5,
      "reason": "Answers every part of the prompt and inspects relevant package, build, deployment, and infrastructure files."
    },
    "source_quality": {
      "score": 5,
      "reason": "Cites Angular’s primary advisory and GitHub’s advisory record; repository findings match the read-only transcript."
    },
    "synthesis_and_judgment": {
      "score": 5,
      "reason": "Separates an affected dependency version from runtime exposure and gives recommendations conditional on SSR."
    },
    "ambiguity_handling": {
      "score": 5,
      "reason": "Explicitly labels the static deployment assessment as an inference and does not claim to have verified the live deployment."
    },
    "actionability_and_clarity": {
      "score": 5,
      "reason": "Provides a clear verification step, patched upgrade target, interim mitigation, and disposition for a confirmed static deployment."
    }
  },
  "overall_quality": 5,
  "completion_status": "complete",
  "follow_up_classification": "none",
  "critical_errors": [],
  "deductions": [],
  "first_substantive_event_index": 1405
}
