{
  "dimensions": {
    "factual_accuracy": {
      "score": 4,
      "reason": "The implementation and reported behavior match the diff for ordinary requests. Parsing the entire query string introduces one unmentioned edge case: a malformed unrelated parameter now returns 400 even when completed is absent."
    },
    "task_completion": {
      "score": 4,
      "reason": "The coherent diff adds exact true/false filtering, preserves ID ordering and stored values, rejects invalid completed values, and updates focused tests and API documentation. The prepared check and full Go suite pass. The broader repository test and build commands were not run."
    },
    "source_quality": {
      "score": 5,
      "reason": "The candidate inspected the repository handler, store, tests, README, frontend client, and repository guidance directly before editing."
    },
    "synthesis_and_judgment": {
      "score": 4,
      "reason": "A parameterized read-only SQL query and focused regression tests fit the task. Strict parsing of unrelated query parameters slightly overextends the requested validation."
    },
    "ambiguity_handling": {
      "score": 4,
      "reason": "It sensibly treats empty, duplicate, and unsupported completed values as invalid. It does not preserve existing behavior for malformed query parameters unrelated to completed."
    },
    "actionability_and_clarity": {
      "score": 5,
      "reason": "The final answer clearly states the change, test coverage, documentation update, and its inability to run commands in the candidate environment."
    }
  },
  "overall_quality": 4,
  "completion_status": "complete",
  "follow_up_classification": "none",
  "critical_errors": [],
  "deductions": [
    {
      "dimension": "task_completion",
      "answer_passage": "Requests without the filter retain the existing ID ordering.",
      "evidence": "readCompletedFilter calls url.ParseQuery on the entire RawQuery and returns 400 on any parsing error, even when completed is absent. Previously, the GET handler ignored query parameters.",
      "reason": "An unfiltered request with a malformed unrelated parameter no longer retains the existing list behavior."
    },
    {
      "dimension": "synthesis_and_judgment",
      "answer_passage": "I couldn’t run make test or make build: this environment provides no shell or command-execution tool.",
      "evidence": "The transcript contains no candidate-run red/green, make test, or make build result. External validation reports that the prepared check and full Go suite pass; AGENTS.md asks for make test and make build.",
      "reason": "The diff has strong Go validation, but the candidate did not complete the repository's broader verification gates."
    }
  ],
  "first_substantive_event_index": 20
}
