{
  "dimensions": {
    "factual_accuracy": {
      "score": 3,
      "reason": "The patch hashes symlink target text, including for broken links, and retains path and file-byte hashing. The claim that focused coverage was added is contradicted by the delivered diff."
    },
    "task_completion": {
      "score": 3,
      "reason": "The core behavior is implemented and the full runner suite passes, but the delivered diff contains no focused test. A valid-link retarget can also leave the digest unchanged because target text and followed file bytes have no separator."
    },
    "source_quality": {
      "score": 4,
      "reason": "The assessment is supported by the actual diff, repository test excerpts, and validation output. The transcript's 17-test run does not establish that its edited test was delivered."
    },
    "synthesis_and_judgment": {
      "score": 3,
      "reason": "The change addresses the broken-link case while preserving existing checks, but does not account for ambiguous concatenation or reconcile the missing test with the final claim."
    },
    "ambiguity_handling": {
      "score": 2,
      "reason": "The implementation does not frame symlink target text separately from file content, leaving a deterministic case where retargeting a valid link produces the same hash input."
    },
    "actionability_and_clarity": {
      "score": 4,
      "reason": "The final answer clearly identifies the change and test command, though its test coverage claim overstates the delivered artifact."
    }
  },
  "overall_quality": 3,
  "completion_status": "partial",
  "follow_up_classification": "necessary",
  "critical_errors": [
    {
      "claim": "Retargeting a link changes the workspace integrity digest.",
      "impact": "A valid symlink can be retargeted without changing the digest.",
      "evidence": "The patch concatenates target text directly before followed file bytes. If files `a` and `ab` contain `bc` and `c` respectively, a link retargeted from `a` to `ab` contributes `abc` in both cases; the other files remain unchanged."
    },
    {
      "claim": "Added focused coverage in `tests/test_eval_du04.py`.",
      "impact": "The requested focused regression test is absent from the delivered code.",
      "evidence": "The actual code patch changes only `src/agent_eval/core.py`; untracked file paths are empty. The transcript shows the test as untracked and edited, while final validation discovers 16 tests rather than the transcript's 17."
    }
  ],
  "deductions": [
    {
      "dimension": "task_completion",
      "answer_passage": "Added focused coverage in `tests/test_eval_du04.py`",
      "evidence": "The delivered diff contains only two added lines in `src/agent_eval/core.py`; untracked file paths are empty, and prepared checks intact is false.",
      "reason": "Focused coverage was not retained in the deliverable."
    },
    {
      "dimension": "factual_accuracy",
      "answer_passage": "all 17 tests passed, including the runner tests",
      "evidence": "The transcript records a 17-test pass with an untracked edited test. The supplied final validation records 16 passing tests.",
      "reason": "The reported run occurred, but its count does not describe the delivered artifact."
    },
    {
      "dimension": "ambiguity_handling",
      "answer_passage": "`tree_digest` includes each symlink’s target text",
      "evidence": "The diff calls `digest.update(str(path.readlink()).encode())` immediately before `digest.update(path.read_bytes())` for valid file links.",
      "reason": "Without framing, different target-text and file-byte pairs can yield identical hash input."
    },
    {
      "dimension": "task_completion",
      "answer_passage": "**Checks:** `python3 -m unittest discover -s tests -v`",
      "evidence": "The transcript shows a green run after editing the implementation and test; it shows no red run. The evidence pack states the prepared broken-link test fails at the pinned commit.",
      "reason": "Green validation is supported, but the submitted work does not demonstrate a retained red/green regression test."
    }
  ],
  "first_substantive_event_index": 1820
}
